strongs	greek	count	brief	long
1108	γνώσεως	1	ज्ञान, सिद्धांत, ज्ञान	ज्ञान, सिद्धांत, ज्ञान।
4137	πληρωθῆτε	1	मैं, पूरा भरने, पूरा	मैं भरने, पूरा, पूरा।
4138	πλήρωμα	1	परिपूर्णता, पूर्ति, पूरा	(क) एक भरने, परिपूर्णता; पूर्ण पूरक; आपूर्ति, पैच, पूरक, (ख) परिपूर्णता, भरने, पूरा, पूरा हो।
1198	δέσμιος	1	एक ही, एक कैदी	एक ही है, एक कैदी।
1161	δὲ	1	लेकिन, दूसरे हाथ पर, और	एक कमजोर िवरोधसूचक कण, आम तौर पर अपने खंड में दूसरे नंबर पर रखा गया है; लेकिन, दूसरी ओर, और पर।
3972	Παῦλος	1	पॉल	पॉल, Paulus।
2228	ἢ	1	या, की तुलना	या, की तुलना में।
1754	ἐνεργουμένην	1	मैं काम करते हैं, पूरा, ऑपरेटिव हूं	मैं काम करते हैं, ऑपरेटिव हूँ, काम पर हूँ, काम करने के लिए, को पूरा कर दिया हूँ; मध्य: मैं काम, प्रदर्शन गतिविधि।
281	ἀμήν.	1	वास्तव में, वास्तव में, आमीन, तो रहने दो	वास्तव में, वास्तव में, आमीन; पर वाक्य के अंत तक paraphrased जा सकता है: तो रहने दो।